{
  "schema_version": "1.0",
  "device_id": "bms-001",
  "gateway_id": "gw-001",
  "site_id": "site-001",
  "boot_id": "b7f3a91c",
  "sequence": 1040,
  "timestamps": {
    "measured_at": null,
    "gateway_received_at": "2026-10-09T14:18:00Z",
    "published_at": "2026-10-09T14:31:10Z"
  },
  "thingset": {
    "rPackVoltage_V": 13.27,
    "rPackCurrent_A": -1.98,
    "rCellTemps_degC": [26.5, 26.9],
    "rICTemp_degC": 31.0,
    "rSOC_pct": 79.6,
    "rErrorFlags": 0,
    "rBmsState": 3,
    "rCellVoltages_V": [3.315, 3.306, 3.321, 3.312],
    "rCellAvgVoltage_V": 3.314,
    "rCellMinVoltage_V": 3.306,
    "rCellMaxVoltage_V": 3.321,
    "rBalancingStatus": 0
  }
}
